{
	"name": "MyConsumer",
    "description": "Sends message to output",
    "properties": "MyConsumer.properties.schema.json",
    "inputs": [
        {
            "name": "in",
            "type": "sreceiver",
            "acceptedDatatypes": [
                {
                    "datatype": "ImgFrame"
                }
            ]
        }
    ]
}